{
  "budget": [
    "当初予算額",
    "補正予算額",
    "継続費及び繰越事業費繰越額",
    "予備費支出及び流用増減",
    "計"
  ],
  "page_width": 595.32,
  "body_top": 105,
  "body_bottom": 775,
  "label_right": 110,
  "budget_left": 95.0,
  "budget_right": 421.0,
  "budget_rules": [
    [
      95.6,
      167.0
    ],
    [
      167.0,
      238.3
    ],
    [
      238.3,
      297.8
    ],
    [
      297.8,
      355.7
    ],
    [
      355.7,
      420.4
    ]
  ],
  "setsu_num_left": 415,
  "setsu_num_right": 431,
  "setsu_name_left": 428,
  "setsu_name_right": 482,
  "setsu_amount_left": 482,
  "r_paid_right": 123,
  "r_carry_right": 195,
  "r_unused_right": 257,
  "note_left": 257,
  "inner_labels": [
    "繰越明許費",
    "事故繰越",
    "支出済額",
    "不用額",
    "本年度支出額",
    "翌年度繰越額"
  ],
  "sub_name_left": 298,
  "sub_amount_right": 525,
  "executed_keys": [
    "支出済額",
    "翌年度繰越額",
    "不用額"
  ],
  "summary_cols": [
    "款_番号",
    "款_名称",
    "項_番号",
    "項_名称",
    "予算現額",
    "支出済額",
    "翌年度繰越額",
    "不用額",
    "予算現額と支出済額との比較",
    "物理頁",
    "上端",
    "下端"
  ],
  "summary_bounds": [
    [
      60,
      200,
      "支出済額"
    ],
    [
      200,
      340,
      "翌年度繰越額"
    ],
    [
      340,
      460,
      "不用額"
    ],
    [
      460,
      580,
      "予算現額と支出済額との比較"
    ]
  ]
}
